{
  "$schema": "./clubs.schema.json",
  "schema_version": "1.0.0",
  "title": "Mobile Poker Club Data",
  "description": "Public listing data for mobile poker clubs across PPPoker, PokerBros, ClubGG and X-Poker.",
  "creator": {
    "name": "James Holden",
    "role": "Editor-in-Chief and Lead Analyst"
  },
  "publisher": "Poker Catalog",
  "website": "https://pppoker-catalog.com",
  "source_catalog": "https://pppoker-catalog.com/clubs/",
  "snapshot_date": "2026-07-29",
  "timezone": "Asia/Bangkok",
  "license": "CC-BY-4.0",
  "known_source_conflicts": [
    {
      "id": "x-poker-max-rakeback",
      "field": "max_rakeback_percent",
      "app": "X-Poker",
      "app_page_value": 50,
      "club_slug": "game-of-molly",
      "club_page_value": 60,
      "resolution": "Both published source values are preserved; the club record uses the club-page value."
    },
    {
      "id": "pppoker-max-rakeback",
      "field": "max_rakeback_percent",
      "app": "PPPoker",
      "app_page_value": 60,
      "club_slug": "mollys-pppoker",
      "club_page_value": 65,
      "resolution": "Both published source values are preserved; the club record uses the club-page value."
    }
  ],
  "clubs": [
    {
      "slug": "game-of-molly",
      "name": "Game Of Molly",
      "app": "X-Poker",
      "club_id": null,
      "club_id_access": "Ask listed representative",
      "union": "Black Sea",
      "max_rakeback_percent": 60,
      "peak_traffic": {"display": "350–700 players", "min_players": 350, "max_players": 700, "open_ended": false},
      "games": ["NLH", "PLO6"],
      "stakes": ["Micro", "Mid Stakes", "High Stakes"],
      "countries": ["CIS"],
      "nfnd": true,
      "jackpot": false,
      "source_updated_at": "2026-06-18",
      "source_url": "https://pppoker-catalog.com/clubs/game-of-molly/"
    },
    {
      "slug": "777-club",
      "name": "777 Club",
      "app": "X-Poker",
      "club_id": null,
      "club_id_access": "Ask listed representative",
      "union": "Malaysia Union",
      "max_rakeback_percent": 50,
      "peak_traffic": {"display": "400–800 players", "min_players": 400, "max_players": 800, "open_ended": false},
      "games": ["NLH", "PLO6", "AOF", "PUSOY", "SUSHI"],
      "stakes": ["Micro", "Mid Stakes"],
      "countries": ["Vietnam"],
      "nfnd": false,
      "jackpot": false,
      "source_updated_at": "2026-06-18",
      "source_url": "https://pppoker-catalog.com/clubs/777-club/"
    },
    {
      "slug": "the-flying-dutchman",
      "name": "The Flying Dutchman",
      "app": "PokerBros",
      "club_id": null,
      "club_id_access": "Ask listed representative",
      "union": "Paradise Union",
      "max_rakeback_percent": 50,
      "peak_traffic": {"display": "1000+ players", "min_players": 1000, "max_players": null, "open_ended": true},
      "games": ["NLH", "PLO4", "PLO6", "SPIN-IT", "MTT"],
      "stakes": ["Micro", "Mid Stakes"],
      "countries": ["USA"],
      "nfnd": false,
      "jackpot": true,
      "source_updated_at": "2026-07-23",
      "source_url": "https://pppoker-catalog.com/clubs/the-flying-dutchman/"
    },
    {
      "slug": "malibu-sunsets",
      "name": "Malibu Sunsets",
      "app": "PokerBros",
      "club_id": null,
      "club_id_access": "Ask listed representative",
      "union": "Stars & Stripes Union",
      "max_rakeback_percent": 50,
      "peak_traffic": {"display": "500+ players", "min_players": 500, "max_players": null, "open_ended": true},
      "games": ["PLO5", "PLO6", "HEADS-UP", "MTT"],
      "stakes": ["Micro", "Mid Stakes"],
      "countries": ["USA"],
      "nfnd": false,
      "jackpot": true,
      "source_updated_at": "2026-07-23",
      "source_url": "https://pppoker-catalog.com/clubs/malibu-sunsets/"
    },
    {
      "slug": "npn-massiv",
      "name": "NPN Massiv",
      "app": "ClubGG",
      "club_id": null,
      "club_id_access": "Ask listed representative",
      "union": "Massiv Union",
      "max_rakeback_percent": 60,
      "peak_traffic": {"display": "1000+ players", "min_players": 1000, "max_players": null, "open_ended": true},
      "games": ["NLH", "PLO4", "PLO5", "PLO6", "HEADS-UP", "MTT", "SNG", "AOF"],
      "stakes": ["Micro", "Mid Stakes", "High Stakes", "High Roller"],
      "countries": ["USA"],
      "nfnd": false,
      "jackpot": true,
      "source_updated_at": "2026-07-22",
      "source_url": "https://pppoker-catalog.com/clubs/npn-massiv/"
    },
    {
      "slug": "machines",
      "name": "Machines",
      "app": "ClubGG",
      "club_id": null,
      "club_id_access": "Ask listed representative",
      "union": "TMT (Time Machine Tables Union)",
      "max_rakeback_percent": 60,
      "peak_traffic": {"display": "700+ players", "min_players": 700, "max_players": null, "open_ended": true},
      "games": ["NLH", "PLO4", "MTT"],
      "stakes": ["Mid Stakes", "High Stakes", "High Roller"],
      "countries": ["USA"],
      "nfnd": false,
      "jackpot": true,
      "source_updated_at": "2026-07-23",
      "source_url": "https://pppoker-catalog.com/clubs/machines/"
    },
    {
      "slug": "nuts",
      "name": "Nuts",
      "app": "PPPoker",
      "club_id": null,
      "club_id_access": "Ask listed representative",
      "union": "Evolution Poker",
      "max_rakeback_percent": 50,
      "peak_traffic": {"display": "400–500+ players", "min_players": 400, "max_players": 500, "open_ended": true},
      "games": ["NLH", "PLO5", "PLO6", "AOF", "OFC", "MTT"],
      "stakes": ["Micro", "Mid Stakes", "High Stakes"],
      "countries": ["Latin America"],
      "nfnd": false,
      "jackpot": true,
      "source_updated_at": "2026-07-23",
      "source_url": "https://pppoker-catalog.com/clubs/nuts/"
    },
    {
      "slug": "goldfish",
      "name": "GoldFish",
      "app": "X-Poker",
      "club_id": null,
      "club_id_access": "Ask listed representative",
      "union": "Taiwan Union",
      "max_rakeback_percent": 50,
      "peak_traffic": {"display": "300–600 players", "min_players": 300, "max_players": 600, "open_ended": false},
      "games": ["NLH", "AOF", "PLO4"],
      "stakes": ["Mid Stakes", "High Stakes"],
      "countries": ["Thailand", "Taiwan"],
      "nfnd": true,
      "jackpot": false,
      "source_updated_at": "2026-06-18",
      "source_url": "https://pppoker-catalog.com/clubs/goldfish/"
    },
    {
      "slug": "gambit",
      "name": "Gambit",
      "app": "X-Poker",
      "club_id": null,
      "club_id_access": "Ask listed representative",
      "union": "Philippines",
      "max_rakeback_percent": 50,
      "peak_traffic": {"display": "500+ players", "min_players": 500, "max_players": null, "open_ended": true},
      "games": ["NLH", "PLO4", "OFC", "PUSOY", "MTT"],
      "stakes": ["Micro", "Mid Stakes"],
      "countries": ["Philippines"],
      "nfnd": false,
      "jackpot": true,
      "source_updated_at": "2026-07-23",
      "source_url": "https://pppoker-catalog.com/clubs/gambit/"
    },
    {
      "slug": "gambits-room",
      "name": "Gambit's Room",
      "app": "PPPoker",
      "club_id": null,
      "club_id_access": "Ask listed representative",
      "union": "Pinoy Donks",
      "max_rakeback_percent": 60,
      "peak_traffic": {"display": "600+ players", "min_players": 600, "max_players": null, "open_ended": true},
      "games": ["NLH", "PLO5", "SHORT-DECK", "HEADS-UP"],
      "stakes": ["Micro", "Mid Stakes"],
      "countries": ["Philippines"],
      "nfnd": false,
      "jackpot": true,
      "source_updated_at": "2026-07-23",
      "source_url": "https://pppoker-catalog.com/clubs/gambits-room/"
    },
    {
      "slug": "mollys-pppoker",
      "name": "Molly's",
      "app": "PPPoker",
      "club_id": null,
      "club_id_access": "Ask listed representative",
      "union": "Yamal",
      "max_rakeback_percent": 65,
      "peak_traffic": {"display": "450–900 players", "min_players": 450, "max_players": 900, "open_ended": false},
      "games": ["NLH", "PLO4", "PLO5"],
      "stakes": ["Micro", "Mid Stakes", "High Stakes"],
      "countries": ["CIS"],
      "nfnd": true,
      "jackpot": false,
      "source_updated_at": "2026-06-18",
      "source_url": "https://pppoker-catalog.com/clubs/mollys-pppoker/"
    }
  ]
}
